{"schemaVersion":1,"shardId":"hebrew-H3101-H3200","scope":{"kind":"language-strong-range","language":"hebrew","startStrong":"H3101","endStrong":"H3200"},"count":1,"entries":[{"identity":{"schemaVersion":1,"identityId":"H3117","sourceForms":["H3117"],"canonicalStrong":"H3117","baseStrong":"H3117","disambiguationSuffix":null,"namespace":"strong","testament":"old-testament","language":"hebrew","lemma":"יוֹם","lemmaNormalized":"יוֹם","transliteration":{"scientific":"yôm","korean":"욤"},"partOfSpeech":{"code":"N","labelEn":"noun","labelKo":"명사"},"sourceRefs":[{"sourceId":"openscriptures-hebrewlexicon-bdb","locator":"BrownDriverBriggs.xml:j.ay.aa"}],"identityFingerprint":"sha256:a94a0a567a744581828fcaca38f8e7e37c71f98d3dbeede19a5af5ebd9e7c8ac"},"approvedSenseTree":[{"id":"1","parentId":null,"depth":0,"order":1,"translationKo":"יוֹם, 남성 명사: 날. 밤과 대조되는 낮, 시간의 구분으로서의 날, 여호와의 날, 사람의 생애를 이루는 날들, 날들, 때, 여러 관용 표현에 쓰인다.","evidenceSupport":"direct"},{"id":"1.1","parentId":"1","depth":1,"order":2,"translationKo":"밤과 대조되는 낮, 날.","evidenceSupport":"direct"},{"id":"1.2","parentId":"1","depth":1,"order":3,"translationKo":"시간을 나누는 단위로서의 날.","evidenceSupport":"direct"},{"id":"1.3","parentId":"1","depth":1,"order":4,"translationKo":"יוֹם י׳, 여호와의 날: 주로 그가 심판하러 오시는 때를 가리키며, 의인에게 복을 수반하는 경우가 많다.","evidenceSupport":"direct"},{"id":"1.4","parentId":"1","depth":1,"order":5,"translationKo":"어떤 사람의 날들, 곧 그 사람에게 속한 생애의 날들.","evidenceSupport":"direct"},{"id":"1.5","parentId":"1","depth":1,"order":6,"translationKo":"날들.","evidenceSupport":"direct"},{"id":"1.6","parentId":"1","depth":1,"order":7,"translationKo":"יוֹם이 ‘때’를 뜻하는 용법.","evidenceSupport":"direct"},{"id":"1.7","parentId":"1","depth":1,"order":8,"translationKo":"여러 관용 표현.","evidenceSupport":"direct"}],"reviewer":{"reviewerId":"lexicon-v4-evidence-and-gate","reviewerType":"evidence-policy"},"approvedAt":"2026-08-11T01:58:00Z","evidencePacketFingerprint":"sha256:d9e507deef6c67856506ef06465e1adf85451b9d384515a65954f18f0a0f635e"}],"shardFingerprint":"sha256:f2c5929940ab088985a254186bd9ebd924b05311e44561abb2d56ca08c46f5bd"}
